{
  "id": "ws_01H8Q7K3VZ2X4F",
  "name": "monorepo-main",
  "kind": "cloud",
  "editor": "vscode",
  "root_folders": [
    {
      "path": "/workspaces/monorepo/services/api",
      "name": "api",
      "scheme": "vscode-remote"
    },
    {
      "path": "/workspaces/monorepo/web",
      "name": "web",
      "scheme": "vscode-remote"
    }
  ],
  "runtime": {
    "language": "typescript",
    "container_image": "ghcr.io/example/devcontainer:latest",
    "resources": {
      "cpu": "4",
      "memory_mb": 8192
    }
  },
  "extensions_installed": [
    "ms-python.python",
    "dbaeumer.vscode-eslint",
    "GitHub.copilot"
  ],
  "status": "running",
  "created_at": "2026-05-19T12:34:56Z",
  "last_active_at": "2026-05-19T14:22:01Z"
}
